Enter password: ****
Welcome to the MySQL monitor.  Commands end with ; or \g.
Your MySQL connection id is 21
Server version: 8.0.46 MySQL Community Server - GPL

Copyright (c) 2000, 2026, Oracle and/or its affiliates.

Oracle is a registered trademark of Oracle Corporation and/or its
affiliates. Other names may be trademarks of their respective
owners.

Type 'help;' or '\h' for help. Type '\c' to clear the current input statement.

mysql> SHOW DATABASES;
+--------------------+
| Database           |
+--------------------+
| information_schema |
| mysql              |
| performance_schema |
| pfs                |
| pfs6               |
| sys                |
+--------------------+
6 rows in set (0.01 sec)

mysql> USE PFS6;
Database changed
mysql> SHOW TABLES;
+-----------------+
| Tables_in_pfs6  |
+-----------------+
| codegnan_emp    |
| company_staff   |
| student_details |
+-----------------+
3 rows in set (0.01 sec)

mysql> DESC CODEGNAN_EMPLOYEES;
ERROR 1146 (42S02): Table 'pfs6.codegnan_employees' doesn't exist
mysql> DESC TABLE CODEGNAN_EMPLOYEES;
ERROR 1146 (42S02): Table 'pfs6.codegnan_employees' doesn't exist
mysql> DESC CODEGNAN_EMP;
+----------+-------------+------+-----+---------+-------+
| Field    | Type        | Null | Key | Default | Extra |
+----------+-------------+------+-----+---------+-------+
| EMPID    | char(5)     | YES  |     | NULL    |       |
| FNAME    | varchar(70) | YES  |     | NULL    |       |
| LASTNAME | varchar(50) | YES  |     | NULL    |       |
| AGE      | int         | YES  |     | NULL    |       |
| DOJ      | date        | YES  |     | NULL    |       |
| ADDRESS  | tinytext    | YES  |     | NULL    |       |
| DEPT     | varchar(20) | YES  |     | NULL    |       |
+----------+-------------+------+-----+---------+-------+
7 rows in set (0.00 sec)

mysql> INSERT INTO CODEGNAN_EMP(EMPID,FNAME,LASTNAME,AGE,DOJ,ADDRESS,DEPT)
    -> VALUES
    -> ('E0001','ARJUN','SARKAR',27,'2024-03-20','HYD','TRAINING');
Query OK, 1 row affected (0.03 sec)

mysql> SELECT*FROM CODEGNAN_EMP;
+-------+-------+----------+------+------------+---------+----------+
| EMPID | FNAME | LASTNAME | AGE  | DOJ        | ADDRESS | DEPT     |
+-------+-------+----------+------+------------+---------+----------+
| E0001 | ARJUN | SARKAR   |   27 | 2024-03-20 | HYD     | TRAINING |
+-------+-------+----------+------+------------+---------+----------+
1 row in set (0.00 sec)

mysql> INSERT INTO CODEGNAN_EMP(EMPID,FNAME,LASTNAME,AGE,DOJ,ADDRESS,DEPT)
    -> VALUES
    -> ('E0002','RAM','DEV',29,'2022-04-29','PUNE','YOGA');
Query OK, 1 row affected (0.02 sec)

mysql> SELECT*FROM CODEGNAN_EMP
    -> SELECT*FROM CODEGNAN_EMP;
ERROR 1064 (42000): You have an error in your SQL syntax; check the manual that corresponds to your MySQL server version for the right syntax to use near 'SELECT*FROM CODEGNAN_EMP' at line 2
mysql> ^C
mysql> SELECT*FROM CODEGNAN_EMP;
+-------+-------+----------+------+------------+---------+----------+
| EMPID | FNAME | LASTNAME | AGE  | DOJ        | ADDRESS | DEPT     |
+-------+-------+----------+------+------------+---------+----------+
| E0001 | ARJUN | SARKAR   |   27 | 2024-03-20 | HYD     | TRAINING |
| E0002 | RAM   | DEV      |   29 | 2022-04-29 | PUNE    | YOGA     |
+-------+-------+----------+------+------------+---------+----------+
2 rows in set (0.00 sec)

mysql> INSERT INTO CODEGNAN_EMP(EMPID,FNAME,LASTNAME,AGE,DOJ,ADDRESS,DEPT)
    -> VALUES
    -> ('E0003','SACHIN','TENDULKAR',32,'2002-03-31','MUMBAI','CRICKET'),
    -> ('E0004','DHONI','MAHENDRA',29,'2010-05-07','MUMBAI','CRICKET');
Query OK, 2 rows affected (0.01 sec)
Records: 2  Duplicates: 0  Warnings: 0

mysql> SELECT*FROM CODEGNAN_EMP;
+-------+--------+-----------+------+------------+---------+----------+
| EMPID | FNAME  | LASTNAME  | AGE  | DOJ        | ADDRESS | DEPT     |
+-------+--------+-----------+------+------------+---------+----------+
| E0001 | ARJUN  | SARKAR    |   27 | 2024-03-20 | HYD     | TRAINING |
| E0002 | RAM    | DEV       |   29 | 2022-04-29 | PUNE    | YOGA     |
| E0003 | SACHIN | TENDULKAR |   32 | 2002-03-31 | MUMBAI  | CRICKET  |
| E0004 | DHONI  | MAHENDRA  |   29 | 2010-05-07 | MUMBAI  | CRICKET  |
+-------+--------+-----------+------+------------+---------+----------+
4 rows in set (0.00 sec)

mysql> INSERT INTO CODEGNAN_EMP VALUES('E0005','MAHESH','BABU',51,'2026-09-09','HYD','ACTING');
Query OK, 1 row affected (0.01 sec)

mysql> SELECT*FROM CODEGNAN_EMP;
+-------+--------+-----------+------+------------+---------+----------+
| EMPID | FNAME  | LASTNAME  | AGE  | DOJ        | ADDRESS | DEPT     |
+-------+--------+-----------+------+------------+---------+----------+
| E0001 | ARJUN  | SARKAR    |   27 | 2024-03-20 | HYD     | TRAINING |
| E0002 | RAM    | DEV       |   29 | 2022-04-29 | PUNE    | YOGA     |
| E0003 | SACHIN | TENDULKAR |   32 | 2002-03-31 | MUMBAI  | CRICKET  |
| E0004 | DHONI  | MAHENDRA  |   29 | 2010-05-07 | MUMBAI  | CRICKET  |
| E0005 | MAHESH | BABU      |   51 | 2026-09-09 | HYD     | ACTING   |
+-------+--------+-----------+------+------------+---------+----------+
5 rows in set (0.00 sec)

mysql> INSERT INTO CODEGNAN_EMP(EMPID,FNAME,AGE,ADDRESS)
    -> VLUES
    -> ('E0006','VAMSI',24,'ANAKAPALLI');
ERROR 1064 (42000): You have an error in your SQL syntax; check the manual that corresponds to your MySQL server version for the right syntax to use near 'VLUES
('E0006','VAMSI',24,'ANAKAPALLI')' at line 2
mysql> INSERT INTO CODEGNAN_EMP(EMPID,FNAME,AGE,ADDRESS)
    -> VALUES
    -> ('E0006','VAMSI',24,'ANAKAPALLI');
Query OK, 1 row affected (0.01 sec)

mysql> SELECT*FROM CODEGNAN_EMP;
+-------+--------+-----------+------+------------+------------+----------+
| EMPID | FNAME  | LASTNAME  | AGE  | DOJ        | ADDRESS    | DEPT     |
+-------+--------+-----------+------+------------+------------+----------+
| E0001 | ARJUN  | SARKAR    |   27 | 2024-03-20 | HYD        | TRAINING |
| E0002 | RAM    | DEV       |   29 | 2022-04-29 | PUNE       | YOGA     |
| E0003 | SACHIN | TENDULKAR |   32 | 2002-03-31 | MUMBAI     | CRICKET  |
| E0004 | DHONI  | MAHENDRA  |   29 | 2010-05-07 | MUMBAI     | CRICKET  |
| E0005 | MAHESH | BABU      |   51 | 2026-09-09 | HYD        | ACTING   |
| E0006 | VAMSI  | NULL      |   24 | NULL       | ANAKAPALLI | NULL     |
+-------+--------+-----------+------+------------+------------+----------+
6 rows in set (0.00 sec)

mysql> UPDATE CODEGNAN_EMP SET FNAME='GANESH' WHERE EMPID='E0006';
Query OK, 1 row affected (0.01 sec)
Rows matched: 1  Changed: 1  Warnings: 0

mysql> SELECT*FROM CODEGNAN_EMP WHERE EMPID='E0006';
+-------+--------+----------+------+------+------------+------+
| EMPID | FNAME  | LASTNAME | AGE  | DOJ  | ADDRESS    | DEPT |
+-------+--------+----------+------+------+------------+------+
| E0006 | GANESH | NULL     |   24 | NULL | ANAKAPALLI | NULL |
+-------+--------+----------+------+------+------------+------+
1 row in set (0.00 sec)

mysql> UPDATE CODEGNAN_EMP SET EMPID='E0007' WHERE EMPID='E0006';
Query OK, 1 row affected (0.01 sec)
Rows matched: 1  Changed: 1  Warnings: 0

mysql> SELECT*FROM CODEGNAN_EMP;
+-------+--------+-----------+------+------------+------------+----------+
| EMPID | FNAME  | LASTNAME  | AGE  | DOJ        | ADDRESS    | DEPT     |
+-------+--------+-----------+------+------------+------------+----------+
| E0001 | ARJUN  | SARKAR    |   27 | 2024-03-20 | HYD        | TRAINING |
| E0002 | RAM    | DEV       |   29 | 2022-04-29 | PUNE       | YOGA     |
| E0003 | SACHIN | TENDULKAR |   32 | 2002-03-31 | MUMBAI     | CRICKET  |
| E0004 | DHONI  | MAHENDRA  |   29 | 2010-05-07 | MUMBAI     | CRICKET  |
| E0005 | MAHESH | BABU      |   51 | 2026-09-09 | HYD        | ACTING   |
| E0007 | GANESH | NULL      |   24 | NULL       | ANAKAPALLI | NULL     |
+-------+--------+-----------+------+------------+------------+----------+
6 rows in set (0.00 sec)

mysql> UPDATE CODEGNAN_EMP SET EMPID='E0006' WHERE EMPID='E0007';
Query OK, 1 row affected (0.01 sec)
Rows matched: 1  Changed: 1  Warnings: 0

mysql> SELECT*FROM CODEGNAN_EMP;
+-------+--------+-----------+------+------------+------------+----------+
| EMPID | FNAME  | LASTNAME  | AGE  | DOJ        | ADDRESS    | DEPT     |
+-------+--------+-----------+------+------------+------------+----------+
| E0001 | ARJUN  | SARKAR    |   27 | 2024-03-20 | HYD        | TRAINING |
| E0002 | RAM    | DEV       |   29 | 2022-04-29 | PUNE       | YOGA     |
| E0003 | SACHIN | TENDULKAR |   32 | 2002-03-31 | MUMBAI     | CRICKET  |
| E0004 | DHONI  | MAHENDRA  |   29 | 2010-05-07 | MUMBAI     | CRICKET  |
| E0005 | MAHESH | BABU      |   51 | 2026-09-09 | HYD        | ACTING   |
| E0006 | GANESH | NULL      |   24 | NULL       | ANAKAPALLI | NULL     |
+-------+--------+-----------+------+------------+------------+----------+
6 rows in set (0.00 sec)

mysql> UPDATE CODEGNAN_EMP SET LASTNAME='BABU' WHERE LASTNAME IS NULL;
Query OK, 1 row affected (0.01 sec)
Rows matched: 1  Changed: 1  Warnings: 0

mysql> SELECT*FROM CODEGNAN_EMP WHERE EMPID='E0006';
+-------+--------+----------+------+------+------------+------+
| EMPID | FNAME  | LASTNAME | AGE  | DOJ  | ADDRESS    | DEPT |
+-------+--------+----------+------+------+------------+------+
| E0006 | GANESH | BABU     |   24 | NULL | ANAKAPALLI | NULL |
+-------+--------+----------+------+------+------------+------+
1 row in set (0.00 sec)

mysql> UPDATE CODEGNAN_EMP SET DEPT='STUDENT' WHERE DEPT IS NULL;
Query OK, 1 row affected (0.01 sec)
Rows matched: 1  Changed: 1  Warnings: 0

mysql> SELECT*FROM CODEGNAN_EMP;
+-------+--------+-----------+------+------------+------------+----------+
| EMPID | FNAME  | LASTNAME  | AGE  | DOJ        | ADDRESS    | DEPT     |
+-------+--------+-----------+------+------------+------------+----------+
| E0001 | ARJUN  | SARKAR    |   27 | 2024-03-20 | HYD        | TRAINING |
| E0002 | RAM    | DEV       |   29 | 2022-04-29 | PUNE       | YOGA     |
| E0003 | SACHIN | TENDULKAR |   32 | 2002-03-31 | MUMBAI     | CRICKET  |
| E0004 | DHONI  | MAHENDRA  |   29 | 2010-05-07 | MUMBAI     | CRICKET  |
| E0005 | MAHESH | BABU      |   51 | 2026-09-09 | HYD        | ACTING   |
| E0006 | GANESH | BABU      |   24 | NULL       | ANAKAPALLI | STUDENT  |
+-------+--------+-----------+------+------------+------------+----------+
6 rows in set (0.00 sec)

mysql> DELETE FROM CODEGNAN_EMP WHERE EMPID='E0006';
Query OK, 1 row affected (0.01 sec)

mysql> SELECT*FROM CODEGNAN_EMP;
+-------+--------+-----------+------+------------+---------+----------+
| EMPID | FNAME  | LASTNAME  | AGE  | DOJ        | ADDRESS | DEPT     |
+-------+--------+-----------+------+------------+---------+----------+
| E0001 | ARJUN  | SARKAR    |   27 | 2024-03-20 | HYD     | TRAINING |
| E0002 | RAM    | DEV       |   29 | 2022-04-29 | PUNE    | YOGA     |
| E0003 | SACHIN | TENDULKAR |   32 | 2002-03-31 | MUMBAI  | CRICKET  |
| E0004 | DHONI  | MAHENDRA  |   29 | 2010-05-07 | MUMBAI  | CRICKET  |
| E0005 | MAHESH | BABU      |   51 | 2026-09-09 | HYD     | ACTING   |
+-------+--------+-----------+------+------------+---------+----------+
5 rows in set (0.00 sec)

mysql> INSERT INTO CODEGNAN_EMP VALUES('E0006','SAI,'RAM',25,'2024-08-08','VIZAG','ACTING');
    '> INSERT INTO CODEGNAN_EMP VALUES('E0006','SAI,'RAM',25,'2024-08-08','VIZAG','ACTING');
ERROR 1064 (42000): You have an error in your SQL syntax; check the manual that corresponds to your MySQL server version for the right syntax to use near 'RAM',25,'2024-08-08','VIZAG','ACTING');
INSERT INTO CODEGNAN_EMP VALUES('E0006',' at line 1
mysql> INSERT INTO CODEGNAN_EMP VALUES('E0006','SAI,'RAM',25,'2024-08-08','VIZAG','ACTING');
    '> SELECT*FROM CODEGNAN_EMP;
    '> ^C
mysql> TRUNCATE CODEGNAN_EMP;
Query OK, 0 rows affected (0.10 sec)

mysql> SELECT*FROM CODEGNAN_EMP;
Empty set (0.01 sec)

mysql> DROP CODEGNAN_EMP;
ERROR 1064 (42000): You have an error in your SQL syntax; check the manual that corresponds to your MySQL server version for the right syntax to use near 'CODEGNAN_EMP' at line 1
mysql> CREATE TABLE employees (
    ->     emp_id INT PRIMARY KEY,
    ->     emp_name VARCHAR(100),
    ->     department VARCHAR(50),
    ->     job_role VARCHAR(50),
    ->     salary DECIMAL(10,2),
    ->     joining_date DATE,
    ->     city VARCHAR(50)
    -> );
ERROR 1050 (42S01): Table 'employees' already exists
mysql> SELECT*FROM CODEGNAN_EMP;
Empty set (0.00 sec)

mysql> DROP CODEGNAN_EMP;
ERROR 1064 (42000): You have an error in your SQL syntax; check the manual that corresponds to your MySQL server version for the right syntax to use near 'CODEGNAN_EMP' at line 1
mysql> DROP TABLE CODEGNAN_EMP;
Query OK, 0 rows affected (0.04 sec)

mysql> CREATE TABLE employees (
    ->     emp_id INT PRIMARY KEY,
    ->     emp_name VARCHAR(100),
    ->     department VARCHAR(50),
    ->     job_role VARCHAR(50),
    ->     salary DECIMAL(10,2),
    ->     joining_date DATE,
    ->     city VARCHAR(50)
    -> );
ERROR 1050 (42S01): Table 'employees' already exists
mysql> DROP TABLE EMPLOYEES;
Query OK, 0 rows affected (0.03 sec)

mysql> SHOW TABLE;
ERROR 1064 (42000): You have an error in your SQL syntax; check the manual that corresponds to your MySQL server version for the right syntax to use near '' at line 1
mysql> DESC EMPLOYEES;
ERROR 1146 (42S02): Table 'pfs6.employees' doesn't exist
mysql> CREATE TABLE employees (
    ->     emp_id INT PRIMARY KEY,
    ->     emp_name VARCHAR(100),
    ->     department VARCHAR(50),
    ->     job_role VARCHAR(50),
    ->     salary DECIMAL(10,2),
    ->     joining_date DATE,
    ->     city VARCHAR(50)
    -> );
Query OK, 0 rows affected (0.04 sec)

mysql> DESC EMPLOYEES;
+--------------+---------------+------+-----+---------+-------+
| Field        | Type          | Null | Key | Default | Extra |
+--------------+---------------+------+-----+---------+-------+
| emp_id       | int           | NO   | PRI | NULL    |       |
| emp_name     | varchar(100)  | YES  |     | NULL    |       |
| department   | varchar(50)   | YES  |     | NULL    |       |
| job_role     | varchar(50)   | YES  |     | NULL    |       |
| salary       | decimal(10,2) | YES  |     | NULL    |       |
| joining_date | date          | YES  |     | NULL    |       |
| city         | varchar(50)   | YES  |     | NULL    |       |
+--------------+---------------+------+-----+---------+-------+
7 rows in set (0.01 sec)

mysql> INSERT INTO employees
    -> (emp_id, emp_name, department, job_role, salary, joining_date, city)
    -> VALUES
    -> (101, 'Ravi Kumar', 'IT', 'Developer', 45000, '2023-01-15', 'Vizag'),
    -> (102, 'Priya Sharma', 'HR', 'HR Manager', 55000, '2022-06-20', 'Hyderabad'),
    -> (103, 'Kiran Reddy', 'IT', 'Tester', 40000, '2023-03-10', 'Vizag'),
    -> (104, 'Sneha Rao', 'Finance', 'Accountant', 48000, '2021-11-25', 'Chennai'),
    -> (105, 'Arun Kumar', 'IT', 'Developer', 60000, '2020-08-18', 'Bangalore'),
    -> (106, 'Divya Reddy', 'HR', 'Recruiter', 35000, '2024-01-05', 'Vizag'),
    -> (107, 'Suresh Babu', 'Sales', 'Executive', 42000, '2022-09-12', 'Hyderabad'),
    -> (108, 'Anjali Devi', 'IT', 'Developer', 70000, '2019-05-30', 'Chennai'),
    -> (109, 'Mahesh Kumar', 'Sales', 'Manager', 65000, '2020-02-14', 'Bangalore'),
    -> (110, 'Lakshmi Rao', 'Finance', 'Analyst', 52000, '2023-07-22', 'Hyderabad');
Query OK, 10 rows affected (0.01 sec)
Records: 10  Duplicates: 0  Warnings: 0

mysql> SELECT*FROM EMPLOYEES;
+--------+--------------+------------+------------+----------+--------------+-----------+
| emp_id | emp_name     | department | job_role   | salary   | joining_date | city      |
+--------+--------------+------------+------------+----------+--------------+-----------+
|    101 | Ravi Kumar   | IT         | Developer  | 45000.00 | 2023-01-15   | Vizag     |
|    102 | Priya Sharma | HR         | HR Manager | 55000.00 | 2022-06-20   | Hyderabad |
|    103 | Kiran Reddy  | IT         | Tester     | 40000.00 | 2023-03-10   | Vizag     |
|    104 | Sneha Rao    | Finance    | Accountant | 48000.00 | 2021-11-25   | Chennai   |
|    105 | Arun Kumar   | IT         | Developer  | 60000.00 | 2020-08-18   | Bangalore |
|    106 | Divya Reddy  | HR         | Recruiter  | 35000.00 | 2024-01-05   | Vizag     |
|    107 | Suresh Babu  | Sales      | Executive  | 42000.00 | 2022-09-12   | Hyderabad |
|    108 | Anjali Devi  | IT         | Developer  | 70000.00 | 2019-05-30   | Chennai   |
|    109 | Mahesh Kumar | Sales      | Manager    | 65000.00 | 2020-02-14   | Bangalore |
|    110 | Lakshmi Rao  | Finance    | Analyst    | 52000.00 | 2023-07-22   | Hyderabad |
+--------+--------------+------------+------------+----------+--------------+-----------+
10 rows in set (0.00 sec)

mysql> ALTER TABLE EMPLOYEES ADD EMAIL VARCHAR(100);
Query OK, 0 rows affected (0.03 sec)
Records: 0  Duplicates: 0  Warnings: 0

mysql> SELECT*FROM EMPLOYEES;
+--------+--------------+------------+------------+----------+--------------+-----------+-------+
| emp_id | emp_name     | department | job_role   | salary   | joining_date | city      | EMAIL |
+--------+--------------+------------+------------+----------+--------------+-----------+-------+
|    101 | Ravi Kumar   | IT         | Developer  | 45000.00 | 2023-01-15   | Vizag     | NULL  |
|    102 | Priya Sharma | HR         | HR Manager | 55000.00 | 2022-06-20   | Hyderabad | NULL  |
|    103 | Kiran Reddy  | IT         | Tester     | 40000.00 | 2023-03-10   | Vizag     | NULL  |
|    104 | Sneha Rao    | Finance    | Accountant | 48000.00 | 2021-11-25   | Chennai   | NULL  |
|    105 | Arun Kumar   | IT         | Developer  | 60000.00 | 2020-08-18   | Bangalore | NULL  |
|    106 | Divya Reddy  | HR         | Recruiter  | 35000.00 | 2024-01-05   | Vizag     | NULL  |
|    107 | Suresh Babu  | Sales      | Executive  | 42000.00 | 2022-09-12   | Hyderabad | NULL  |
|    108 | Anjali Devi  | IT         | Developer  | 70000.00 | 2019-05-30   | Chennai   | NULL  |
|    109 | Mahesh Kumar | Sales      | Manager    | 65000.00 | 2020-02-14   | Bangalore | NULL  |
|    110 | Lakshmi Rao  | Finance    | Analyst    | 52000.00 | 2023-07-22   | Hyderabad | NULL  |
+--------+--------------+------------+------------+----------+--------------+-----------+-------+
10 rows in set (0.00 sec)

mysql> ALTER TABLE EMPLOYEES ADD PHONE VARCHAR(15);
Query OK, 0 rows affected (0.04 sec)
Records: 0  Duplicates: 0  Warnings: 0

mysql> SELECT*FROM EMPLOYEES;
+--------+--------------+------------+------------+----------+--------------+-----------+-------+-------+
| emp_id | emp_name     | department | job_role   | salary   | joining_date | city      | EMAIL | PHONE |
+--------+--------------+------------+------------+----------+--------------+-----------+-------+-------+
|    101 | Ravi Kumar   | IT         | Developer  | 45000.00 | 2023-01-15   | Vizag     | NULL  | NULL  |
|    102 | Priya Sharma | HR         | HR Manager | 55000.00 | 2022-06-20   | Hyderabad | NULL  | NULL  |
|    103 | Kiran Reddy  | IT         | Tester     | 40000.00 | 2023-03-10   | Vizag     | NULL  | NULL  |
|    104 | Sneha Rao    | Finance    | Accountant | 48000.00 | 2021-11-25   | Chennai   | NULL  | NULL  |
|    105 | Arun Kumar   | IT         | Developer  | 60000.00 | 2020-08-18   | Bangalore | NULL  | NULL  |
|    106 | Divya Reddy  | HR         | Recruiter  | 35000.00 | 2024-01-05   | Vizag     | NULL  | NULL  |
|    107 | Suresh Babu  | Sales      | Executive  | 42000.00 | 2022-09-12   | Hyderabad | NULL  | NULL  |
|    108 | Anjali Devi  | IT         | Developer  | 70000.00 | 2019-05-30   | Chennai   | NULL  | NULL  |
|    109 | Mahesh Kumar | Sales      | Manager    | 65000.00 | 2020-02-14   | Bangalore | NULL  | NULL  |
|    110 | Lakshmi Rao  | Finance    | Analyst    | 52000.00 | 2023-07-22   | Hyderabad | NULL  | NULL  |
+--------+--------------+------------+------------+----------+--------------+-----------+-------+-------+
10 rows in set (0.00 sec)

mysql> ALTER TABLE EMPLOYEES MODIFY PHONE VARCHAR(15);
Query OK, 0 rows affected (0.02 sec)
Records: 0  Duplicates: 0  Warnings: 0

mysql> ALTER TABLE EMPLOYEES RENAME JOB_ROLE TO DESIGNETION;
ERROR 1064 (42000): You have an error in your SQL syntax; check the manual that corresponds to your MySQL server version for the right syntax to use near 'TO DESIGNETION' at line 1
mysql>